<?xml version="1.0" encoding="UTF-8"?>
<tasklist xmlns:xsi="http://www.w3.org/2001/XMLSchema-instance" xsi:noNamespaceSchemaLocation="../tasklist_schema.xsd" name="Test GUIX">
  <options/>
  <run name="Run daemon and install hello" id="1" enabled="true">
    <command>sudo -S `which guix-daemon` --build-users-group=guix-builder --disable-chroot &amp; guix package --verbose -i hello</command>
    <arguments></arguments>
    <timeout>0</timeout>
    <expected_return_code>0</expected_return_code>
    <expected_output></expected_output>
    <stop_on_fail>true</stop_on_fail>
  </run>
  <run name="Run hello" id="2" enabled="true">
    <command>hello</command>
    <arguments></arguments>
    <timeout>0</timeout>
    <expected_return_code>0</expected_return_code>
    <expected_output></expected_output>
    <stop_on_fail>true</stop_on_fail>
  </run>
</tasklist>
