<?xml version="1.0" encoding="UTF-8"?>
<tasklist name="Example task list with a task starting 3 minutes after experiment was started and is running for 5 minutes" xmlns:xsi="http://www.w3.org/2001/XMLSchema-instance" xsi:noNamespaceSchemaLocation="../tasklist_schema.xsd">
	<run id="0" name="get date">
		<start_relative>P3M</start_relative>
		<stop_relative>P5M</stop_relative>
        <command></command> 
        <arguments></arguments> 
        <timeout>10</timeout>
        <expected_return_code>0</expected_return_code>
        <expected_output></expected_output>
        <stop_on_fail>true</stop_on_fail>
	</run> 
</tasklist>
