<?xml version="1.0" encoding="UTF-8"?>
<tasklist name="Simple task list" xmlns:xsi="http://www.w3.org/2001/XMLSchema-instance" xsi:noNamespaceSchemaLocation="../tasklist_schema.xsd">
	<run id="0" name="get date">
        <command>sudo date</command> 
        <arguments></arguments> 
        <timeout>10</timeout>
        <expected_return_code>0</expected_return_code>
        <expected_output></expected_output>
        <stop_on_fail>true</stop_on_fail>
	</run> 
</tasklist>
