<?xml version="1.0" encoding="UTF-8"?>
<tasklist name="Tasklist example" xmlns:xsi="http://www.w3.org/2001/XMLSchema-instance" xsi:noNamespaceSchemaLocation="../tasklist_schema.xsd">
  <task>
        <id>0</id>
        <name>run 1</name>
        <type>run</type> 
        <command>ls</command> 
        <arguments></arguments>
        <timeout>10</timeout> 
        <expected_return_code>0</expected_return_code>
        <expected_output></expected_output>
        <stop_on_fail>0</stop_on_fail>
    </task> 
    <parallel>
      <task>
        <id>1</id>
        <name>run p2a</name>
        <type>run</type> 
        <command>date</command> 
        <arguments></arguments> 
        <timeout>30</timeout>
        <expected_return_code>0</expected_return_code>
        <expected_output></expected_output>
        <stop_on_fail>0</stop_on_fail>
    </task> 
      <task>
        <id>2</id>
        <name>run p2b</name>
        <type>run</type> 
        <command>ls</command> 
        <arguments></arguments> 
        <timeout>30</timeout>
        <expected_return_code>0</expected_return_code>
        <expected_output></expected_output>
        <stop_on_fail>0</stop_on_fail>
    </task>     
    </parallel>
    <sequence>
      <task>
        <id>3</id>
        <name>run 3</name>
        <type>run</type> 
        <command>date</command> 
        <arguments></arguments> 
        <timeout>30</timeout>
        <expected_return_code>0</expected_return_code>
        <expected_output></expected_output>
        <stop_on_fail>0</stop_on_fail>
	  </task>
	   <task>
        <id>4</id>
        <name>run 4</name>
        <type>run</type> 
        <command>date</command> 
        <arguments></arguments> 
        <timeout>30</timeout>
        <expected_return_code>0</expected_return_code>
        <expected_output></expected_output>
        <stop_on_fail>0</stop_on_fail>
	  </task>
    </sequence> 
</tasklist>
